{
  "$schema": "../../../schemas/mcp.schema.json",
  "id": "datacloud-alloydb-postgres-admin-toolbox",
  "type": "mcp",
  "name": "AlloyDB PostgreSQL Admin Toolbox",
  "tagline": "Connect Cline to AlloyDB PostgreSQL Admin Toolbox",
  "description": "This plugin provides a specialized suite of skills for data engineers and database practitioners working on Google Cloud. It acts as an expert assistant, allowing you to use natural language prompts in your preferred coding agent to architect complex data pipelines, transform data with dbt, write Spark and BigQuery SQL notebooks, and orchestrate end-to-end workflows across GCP's data ecosystem.",
  "author": {
    "name": "Data"
  },
  "tags": [
    "data"
  ],
  "verified": false,
  "featured": false,
  "install": {
    "args": [
      "datacloud-alloydb-postgres-admin-toolbox",
      "--",
      "npx",
      "-y",
      "@toolbox-sdk/server@>=1.1.0",
      "--prebuilt",
      "alloydb-postgres-admin",
      "--stdio",
      "--user-agent-metadata",
      "datacloud.codex"
    ]
  }
}
