{
  "$schema": "../../../schemas/mcp.schema.json",
  "id": "sanity",
  "type": "mcp",
  "name": "Sanity",
  "tagline": "Connect Cline to Sanity",
  "description": "Connect Cline to Sanity through this MCP server configuration from the imported plugin marketplace bundle.",
  "author": {
    "name": "Sanity"
  },
  "tags": [
    "software",
    "creative"
  ],
  "verified": false,
  "featured": false,
  "install": {
    "args": [
      "sanity",
      "--transport",
      "http",
      "https://mcp.sanity.io"
    ],
    "notes": "Imported from plugin bundle config `sanity/.mcp.json`."
  },
  "homepage": "https://github.com/sanity-io/agent-toolkit",
  "repo": "https://github.com/sanity-io/agent-toolkit",
  "license": "MIT"
}
