{
  "$schema": "../../../schemas/mcp.schema.json",
  "id": "semgrep",
  "type": "mcp",
  "name": "Semgrep",
  "tagline": "Connect Cline to Semgrep",
  "description": "Scans agent-generated code for security vulnerabilities using Semgrep.",
  "author": {
    "name": "Semgrep"
  },
  "tags": [
    "security",
    "software"
  ],
  "verified": false,
  "featured": false,
  "install": {
    "args": [
      "semgrep",
      "--",
      "semgrep",
      "mcp"
    ],
    "notes": "Imported from plugin bundle config `semgrep/.mcp.json`. The `semgrep` CLI must be available on PATH before starting this MCP server."
  }
}
