{
  "$schema": "../../../schemas/skill.schema.json",
  "id": "endor-setup",
  "type": "skill",
  "name": "Endor Setup",
  "tagline": "Install and run Endor Labs scans from Cline",
  "description": "Setup guidance for installing endorctl, authenticating with Endor Labs, and running dependency or vulnerability scans from a coding workflow.",
  "author": {
    "name": "Endor Labs"
  },
  "homepage": "https://www.endorlabs.com",
  "icon": "./icon.svg",
  "tags": [
    "security",
    "software"
  ],
  "verified": false,
  "featured": false,
  "install": {
    "args": [
      "cline/marketplace",
      "--skill",
      "endor-setup",
      "--full-depth"
    ]
  }
}
