{
  "$schema": "../../../schemas/plugin.schema.json",
  "id": "typescript-lsp",
  "type": "plugin",
  "name": "TypeScript LSP",
  "tagline": "TypeScript language service goto_definition support",
  "description": "Registers `goto_definition(file, line)`. The tool loads the workspace TypeScript project and resolves definitions using the TypeScript language service, giving the agent precise definition lookup instead of relying only on text search.",
  "author": {
    "name": "Cline",
    "url": "https://cline.bot"
  },
  "homepage": "https://github.com/cline/plugins/tree/main/plugins/typescript-lsp",
  "repo": "https://github.com/cline/plugins/tree/main/plugins/typescript-lsp",
  "icon": "./icon.svg",
  "tags": [
    "software"
  ],
  "license": "Apache-2.0",
  "verified": true,
  "featured": true,
  "install": {
    "args": [
      "typescript-lsp"
    ]
  }
}
